{"schema_version":"1.0.0","scorecard_id":"abk:scorecard:artifact-dag-core-v1-control","candidate_manifest_id":"abk:branch-manifest:control-artifact-dag-core-v1","protocol_id":"abk:benchmark:pattern-adoption-v1","evaluated_at":"2026-08-04T23:04:42.9985560Z","status":"running","host":"codex","hard_gates":[{"gate_id":"observable_state_and_errors","status":"pass","rationale":"The frozen raw evidence and reviewer gate inputs support observable_state_and_errors.","evidence_ids":["full-campaign-control-com-01-normal-primary-r1","full-campaign-control-com-01-normal-primary-r2","full-campaign-control-com-01-normal-primary-r3","full-campaign-control-com-02-normal-variant-r1","full-campaign-control-com-02-normal-variant-r2","full-campaign-control-com-02-normal-variant-r3","full-campaign-control-com-03-normal-repeat-r1","full-campaign-control-com-03-normal-repeat-r2","full-campaign-control-com-03-normal-repeat-r3","full-campaign-control-com-04-boundary-minimum-r1","full-campaign-control-com-05-invalid-input-r1","full-campaign-control-com-06-stop-interrupt-r1","full-campaign-control-com-06-stop-interrupt-r2","full-campaign-control-com-06-stop-interrupt-r3","full-campaign-control-spc-01-domain-boundary-r1","full-campaign-control-spc-02-failure-path-r1","full-campaign-control-spc-03-recovery-rollback-r1","full-campaign-control-spc-03-recovery-rollback-r2","full-campaign-control-spc-03-recovery-rollback-r3","full-campaign-control-spc-04-composition-handoff-r1","full-campaign-control-spc-04-composition-handoff-r2","full-campaign-control-spc-04-composition-handoff-r3"]},{"gate_id":"testable_behavior","status":"pass","rationale":"The frozen raw evidence and reviewer gate inputs support testable_behavior.","evidence_ids":["full-campaign-control-com-01-normal-primary-r1","full-campaign-control-com-01-normal-primary-r2","full-campaign-control-com-01-normal-primary-r3","full-campaign-control-com-02-normal-variant-r1","full-campaign-control-com-02-normal-variant-r2","full-campaign-control-com-02-normal-variant-r3","full-campaign-control-com-03-normal-repeat-r1","full-campaign-control-com-03-normal-repeat-r2","full-campaign-control-com-03-normal-repeat-r3","full-campaign-control-com-04-boundary-minimum-r1","full-campaign-control-com-05-invalid-input-r1","full-campaign-control-com-06-stop-interrupt-r1","full-campaign-control-com-06-stop-interrupt-r2","full-campaign-control-com-06-stop-interrupt-r3","full-campaign-control-spc-01-domain-boundary-r1","full-campaign-control-spc-02-failure-path-r1","full-campaign-control-spc-03-recovery-rollback-r1","full-campaign-control-spc-03-recovery-rollback-r2","full-campaign-control-spc-03-recovery-rollback-r3","full-campaign-control-spc-04-composition-handoff-r1","full-campaign-control-spc-04-composition-handoff-r2","full-campaign-control-spc-04-composition-handoff-r3"]},{"gate_id":"declared_authority_and_side_effects","status":"pass","rationale":"The frozen raw evidence and reviewer gate inputs support declared_authority_and_side_effects.","evidence_ids":["full-campaign-control-com-01-normal-primary-r1","full-campaign-control-com-01-normal-primary-r2","full-campaign-control-com-01-normal-primary-r3","full-campaign-control-com-02-normal-variant-r1","full-campaign-control-com-02-normal-variant-r2","full-campaign-control-com-02-normal-variant-r3","full-campaign-control-com-03-normal-repeat-r1","full-campaign-control-com-03-normal-repeat-r2","full-campaign-control-com-03-normal-repeat-r3","full-campaign-control-com-04-boundary-minimum-r1","full-campaign-control-com-05-invalid-input-r1","full-campaign-control-com-06-stop-interrupt-r1","full-campaign-control-com-06-stop-interrupt-r2","full-campaign-control-com-06-stop-interrupt-r3","full-campaign-control-spc-01-domain-boundary-r1","full-campaign-control-spc-02-failure-path-r1","full-campaign-control-spc-03-recovery-rollback-r1","full-campaign-control-spc-03-recovery-rollback-r2","full-campaign-control-spc-03-recovery-rollback-r3","full-campaign-control-spc-04-composition-handoff-r1","full-campaign-control-spc-04-composition-handoff-r2","full-campaign-control-spc-04-composition-handoff-r3"]},{"gate_id":"reversible_or_recoverable","status":"pending","rationale":"The reviewer gate for reversible_or_recoverable is missing or not unanimously passed.","evidence_ids":["full-campaign-control-com-01-normal-primary-r1","full-campaign-control-com-01-normal-primary-r2","full-campaign-control-com-01-normal-primary-r3","full-campaign-control-com-02-normal-variant-r1","full-campaign-control-com-02-normal-variant-r2","full-campaign-control-com-02-normal-variant-r3","full-campaign-control-com-03-normal-repeat-r1","full-campaign-control-com-03-normal-repeat-r2","full-campaign-control-com-03-normal-repeat-r3","full-campaign-control-com-04-boundary-minimum-r1","full-campaign-control-com-05-invalid-input-r1","full-campaign-control-com-06-stop-interrupt-r1","full-campaign-control-com-06-stop-interrupt-r2","full-campaign-control-com-06-stop-interrupt-r3","full-campaign-control-spc-01-domain-boundary-r1","full-campaign-control-spc-02-failure-path-r1","full-campaign-control-spc-03-recovery-rollback-r1","full-campaign-control-spc-03-recovery-rollback-r2","full-campaign-control-spc-03-recovery-rollback-r3","full-campaign-control-spc-04-composition-handoff-r1","full-campaign-control-spc-04-composition-handoff-r2","full-campaign-control-spc-04-composition-handoff-r3"]},{"gate_id":"upstream_runtime_independence","status":"pass","rationale":"The frozen raw evidence and reviewer gate inputs support upstream_runtime_independence.","evidence_ids":["full-campaign-control-com-01-normal-primary-r1","full-campaign-control-com-01-normal-primary-r2","full-campaign-control-com-01-normal-primary-r3","full-campaign-control-com-02-normal-variant-r1","full-campaign-control-com-02-normal-variant-r2","full-campaign-control-com-02-normal-variant-r3","full-campaign-control-com-03-normal-repeat-r1","full-campaign-control-com-03-normal-repeat-r2","full-campaign-control-com-03-normal-repeat-r3","full-campaign-control-com-04-boundary-minimum-r1","full-campaign-control-com-05-invalid-input-r1","full-campaign-control-com-06-stop-interrupt-r1","full-campaign-control-com-06-stop-interrupt-r2","full-campaign-control-com-06-stop-interrupt-r3","full-campaign-control-spc-01-domain-boundary-r1","full-campaign-control-spc-02-failure-path-r1","full-campaign-control-spc-03-recovery-rollback-r1","full-campaign-control-spc-03-recovery-rollback-r2","full-campaign-control-spc-03-recovery-rollback-r3","full-campaign-control-spc-04-composition-handoff-r1","full-campaign-control-spc-04-composition-handoff-r2","full-campaign-control-spc-04-composition-handoff-r3"]},{"gate_id":"no_undocumented_side_effects","status":"pending","rationale":"The reviewer gate for no_undocumented_side_effects is missing or not unanimously passed.","evidence_ids":["full-campaign-control-com-01-normal-primary-r1","full-campaign-control-com-01-normal-primary-r2","full-campaign-control-com-01-normal-primary-r3","full-campaign-control-com-02-normal-variant-r1","full-campaign-control-com-02-normal-variant-r2","full-campaign-control-com-02-normal-variant-r3","full-campaign-control-com-03-normal-repeat-r1","full-campaign-control-com-03-normal-repeat-r2","full-campaign-control-com-03-normal-repeat-r3","full-campaign-control-com-04-boundary-minimum-r1","full-campaign-control-com-05-invalid-input-r1","full-campaign-control-com-06-stop-interrupt-r1","full-campaign-control-com-06-stop-interrupt-r2","full-campaign-control-com-06-stop-interrupt-r3","full-campaign-control-spc-01-domain-boundary-r1","full-campaign-control-spc-02-failure-path-r1","full-campaign-control-spc-03-recovery-rollback-r1","full-campaign-control-spc-03-recovery-rollback-r2","full-campaign-control-spc-03-recovery-rollback-r3","full-campaign-control-spc-04-composition-handoff-r1","full-campaign-control-spc-04-composition-handoff-r2","full-campaign-control-spc-04-composition-handoff-r3"]}],"benchmark":{"status":"complete","case_count":10,"common_case_count":6,"specific_case_count":4,"branches":["control","source_native","abk_native"],"primary_cell_count":30,"case_repeat_policy":[{"case_id":"COM-01-normal-primary","case_class":"common","model_dependent":true,"repeats":3},{"case_id":"COM-02-normal-variant","case_class":"common","model_dependent":true,"repeats":3},{"case_id":"COM-03-normal-repeat","case_class":"common","model_dependent":true,"repeats":3},{"case_id":"COM-04-boundary-minimum","case_class":"common","model_dependent":false,"repeats":1},{"case_id":"COM-05-invalid-input","case_class":"common","model_dependent":false,"repeats":1},{"case_id":"COM-06-stop-interrupt","case_class":"common","model_dependent":true,"repeats":3},{"case_id":"SPC-01-domain-boundary","case_class":"component_specific","model_dependent":false,"repeats":1},{"case_id":"SPC-02-failure-path","case_class":"component_specific","model_dependent":false,"repeats":1},{"case_id":"SPC-03-recovery-rollback","case_class":"component_specific","model_dependent":true,"repeats":3},{"case_id":"SPC-04-composition-handoff","case_class":"component_specific","model_dependent":true,"repeats":3}],"expected_raw_runs":66,"completed_primary_cells":10,"completed_raw_runs":22,"run_evidence_ids":["full-campaign-control-com-01-normal-primary-r1","full-campaign-control-com-01-normal-primary-r2","full-campaign-control-com-01-normal-primary-r3","full-campaign-control-com-02-normal-variant-r1","full-campaign-control-com-02-normal-variant-r2","full-campaign-control-com-02-normal-variant-r3","full-campaign-control-com-03-normal-repeat-r1","full-campaign-control-com-03-normal-repeat-r2","full-campaign-control-com-03-normal-repeat-r3","full-campaign-control-com-04-boundary-minimum-r1","full-campaign-control-com-05-invalid-input-r1","full-campaign-control-com-06-stop-interrupt-r1","full-campaign-control-com-06-stop-interrupt-r2","full-campaign-control-com-06-stop-interrupt-r3","full-campaign-control-spc-01-domain-boundary-r1","full-campaign-control-spc-02